{
  "authorization": {
    "allow_chargeable_access": false,
    "credential_ref": null,
    "project_ref": null
  },
  "earth_engine_selection": null,
  "limits": {
    "max_compute_requests": 0,
    "max_network_bytes": 76000000,
    "max_network_requests": 3
  },
  "materialization_content_sha256": "d05109ad1fe21d1daedb25cb33b7cdd68f504540a5cdd42e00a140a38db561d4",
  "materialization_request_sha256": "b9b44baecfd0226cfcdb61eb8ba6a4fbd594460fac5ff496c0adbc647baab50a",
  "original_source_plan_unchanged": true,
  "output_grid": null,
  "pack_id": "earth-search-copdem-https",
  "requested_asset_roles": [
    "data"
  ],
  "schema_version": "fasterraster.source-materialization-request/v2",
  "source_plan_sha256": "949624942daf983330478ef22dd52c1f75de83b88a1b9ee473f9fc6a64d45ba4",
  "spatial_request": {
    "bbox": [
      -101.06,
      39.38,
      -101.04,
      39.4
    ],
    "bbox_crs": "EPSG:4326",
    "mode": "bbox"
  }
}
