{
  "authorization": {
    "allow_chargeable_access": false,
    "credential_ref": "local-google-adc",
    "project_ref": "earth-engine-research"
  },
  "earth_engine_selection": [
    {
      "dataset_id": "COPERNICUS/S2_SR_HARMONIZED",
      "operation": "load_collection"
    },
    {
      "bbox": [
        -101.06,
        39.38,
        -101.04,
        39.4
      ],
      "operation": "filter_bounds"
    },
    {
      "end": "2023-06-10",
      "operation": "filter_date",
      "start": "2023-06-01"
    },
    {
      "direction": "ascending",
      "operation": "sort_acquisition_time",
      "property": "system:time_start"
    },
    {
      "direction": "ascending",
      "operation": "tie_break_system_index",
      "property": "system:index"
    },
    {
      "operation": "select_first"
    },
    {
      "bands": [
        "B2",
        "B3",
        "B4"
      ],
      "operation": "select_bands"
    }
  ],
  "limits": {
    "max_compute_requests": 1,
    "max_network_bytes": 5000000,
    "max_network_requests": 1
  },
  "materialization_content_sha256": "e851078a4dd2d130f9c6c29e0b024c6c05604ca76d0d7d4aa00e7752efceca3b",
  "materialization_request_sha256": "9cce8b668ab49090b08d740f34e1d458c18f38d52a4976ad5d5f6f373e705730",
  "original_source_plan_unchanged": true,
  "output_grid": {
    "crs": "EPSG:32614",
    "height": 256,
    "transform": [
      10.0,
      0.0,
      322000.0,
      0.0,
      -10.0,
      4363000.0
    ],
    "width": 256
  },
  "pack_id": "earth-engine-sentinel2",
  "requested_asset_roles": [
    "B2",
    "B3",
    "B4"
  ],
  "schema_version": "fasterraster.source-materialization-request/v2",
  "source_plan_sha256": "2a26d55143e2a1d99a90e16fa4b37db9b14778f7f8bab09bab207aa4f3df6b43",
  "spatial_request": {
    "bbox": [
      -101.06,
      39.38,
      -101.04,
      39.4
    ],
    "bbox_crs": "EPSG:4326",
    "mode": "bbox"
  }
}
