{
  "authorization": {
    "allow_chargeable_access": false,
    "credential_ref": null,
    "project_ref": null
  },
  "earth_engine_selection": null,
  "limits": {
    "max_compute_requests": 0,
    "max_network_bytes": 251000000,
    "max_network_requests": 4
  },
  "materialization_content_sha256": "30b83d624ee9add6a98b893a7d286dc3e173f4f5035812ee732815bb3dd3652a",
  "materialization_request_sha256": "5124d58518933bb6c2fee17fcf657f8d8fa2f406d032a139a7c64277d3410b40",
  "original_source_plan_unchanged": true,
  "output_grid": null,
  "pack_id": "planetary-computer-signed",
  "requested_asset_roles": [
    "red"
  ],
  "schema_version": "fasterraster.source-materialization-request/v2",
  "source_plan_sha256": "9dab670e7445e048c6219aa2e2b88bf1e7ab72fd494324a7284beb3c3ad5d4e9",
  "spatial_request": {
    "bbox": [
      -101.06,
      39.38,
      -101.04,
      39.4
    ],
    "bbox_crs": "EPSG:4326",
    "mode": "bbox"
  }
}
